{
  "specversion": "1.0",
  "id": "11111111-1111-4111-8111-111111111111",
  "source": "https://omama.vn/services/order-service",
  "type": "vn.omama.order.placed.v3",
  "subject": "order:11111111-1111-4111-8111-111111111111",
  "time": "2026-10-15T03:00:00Z",
  "datacontenttype": "application/json",
  "data": {
    "aggregate_id": "11111111-1111-4111-8111-111111111111",
    "version": 2,
    "ordinal": 0,
    "status": "PENDING_PAYMENT",
    "payment_status": "PENDING",
    "stock_status": "RESERVED",
    "items_digest": "aaaaaaaaaaaaaaaaaaaaaaaaaaaaaaaaaaaaaaaaaaaaaaaaaaaaaaaaaaaaaaaa",
    "warehouse_id": "warehouse-hue",
    "reservation_id": "11111111-1111-4111-8111-111111111111",
    "stock_resource_version": 1
  }
}
